7/27/2015 14:15:52	625670945236062208	AsYouNotWish	Religion Of Peace? Seculars Should Realize, Terrorists Are Muslims! No Ifs or Buts. No Mercy! Get The Fcuk Out Of India. #GurdaspurAttack	sit-down comedian | sanatana dharma passionate | jihad sauce-maker | if we meet & you don't find me pretty, you are buying me drinks until you do |	13458	1	1
7/27/2015 14:16:06	625671002790342661	jatanacharya	Gurdaspur attackers heard shouting Islamic slogans during siege #GurdaspurAttack http://t.co/MYugHDMEwU via @htTweets	believe in india first, love creativity,cricket,music,debate & hate pseudo secularism,corruption, b+not only blood group,tweet personal, rt not endorsement	4197	1	1
7/27/2015 14:16:16	625671044658032644	redostoneage	Religion of Peace Update: #GurdaspurAttack Terrorists shouted Islamic Slogans http://t.co/bqFc2dW4JS	i love america. i love our constitution. i hope we return to our libertarian values!	7879	1	1
7/27/2015 14:16:32	6.25671E+17	devraghuwanshi_	If those are separatist guerrillas, then IS is also separatist not terrorists, right @AndyMacaskill? http://t.co/Cbok1MO5go #GurdaspurAttack	technocrat. tweets about: technology macroeconomics defence politics education sports or anything | views own rt not	72	1	0
7/27/2015 14:16:51	625671191194398721	saintmoo	@hsb03 we hate pakis like you..fucking pig. Karma is a bitch and it will catch up to you too one day too fukin pakis #GurdaspurAttack.	ad astra per aspera	33	1	1
7/27/2015 14:16:59	625671227311419392	teamsaggitarius	#GurdaspurAttack trending on top. Pakis u will have to pay for all the evil deeds.	only a proud indian, having independent & clear views on national international matters, defence, politics & open support for #azad_balochistan.	19	1	1
7/27/2015 14:18:32	625671617511878656	redostoneage	#ImHardLeft Because I Believe #GurdaspurAttack Terrorists shouting Islamic Slogans Has Nothing To Do With Islam http://t.co/bqFc2dW4JS	i love america. i love our constitution. i hope we return to our libertarian values!	7879	1	1
7/27/2015 14:18:46	625671677079261184	Dayweekaa	Feel bad for Pakis who photoshop India's map showing it broken into many countries, since they can never see it in real. #GurdaspurAttack	stuck between the horizon and the shore, i'm sailing in the ocean of hope and curiosity.	1017	1	1
7/27/2015 14:19:51	625671948853350402	budbaklolu	#GurdaspurAttack Islamic terrorism spreading all over India.Time to hit hard Islamic radicals	मै इस देश के लोगो को बुड़बकलोल बनाता हूँ आैर उन पर राज करता हूँ।	346	1	1
7/27/2015 14:20:02	625671995053584385	nav_nirvana	Did you KNOW ? #GurdaspurAttack #Presstitutes #40PigsWithTerrorist http://t.co/QeVKZgY8rJ	it professional | sapient corporation | gurgaon | bjp - 1002407953 | origin -patna | a proud namo bhakt |	1101	1	0
7/27/2015 14:21:18	625672313489326080	AnandShubhendu	Repeat after me: Terror has no religion. #GurdaspurAttack http://t.co/HvojOhPFl4	a nerd! i've opinion on everything, a bit more on law & healthcare. | tiss alum, law student, avid traveler, quizzer, sapiosexual. unapologetically right.	140	1	2
7/27/2015 14:21:51	625672451557449729	awijeet	Can Indian media, come forward and say these were act of Islamic terrorist. #GurdaspurAttack		804	1	1
7/27/2015 14:22:31	625672620378189825	ranjithasreddy	#GurdaspurAttack look at pakis innovations.......https://t.co/gnztgWzI3W	proud bhakt, nationalist	140	1	1
7/27/2015 14:23:29	625672860565049344	SecularDoctor	The way Indian Media is handling this #GurdaspurAttack #, #Presstitutes is the perfect term for them.	i know, i know nothing. retweets doesn't mean endorsement.	126	1	1
7/27/2015 14:26:00	625673496887078912	yogesh1711	Khalistan is back one Sikh terrorist also kill in #GurdaspurAttack	offshore investment consultant backpackers/foodie/posts and opinions shared are my own. unless they are quotes, retweets, or links.	137	1	1
7/27/2015 14:27:06	625673772390068224	LegalKant	@JhaSanjay @RanaAyyub @ravishndtv @BDUTT #presstitutes filling streets for Gaza will be invisible for fellow Indian victims #GurdaspurAttack	avocat / conomiste / paris-sorbonne	231	1	0
7/27/2015 14:27:56	625673983401168896	AsYouNotWish	#GurdaspurAttack startd w/ "Allahu Fackber" &amp; ended w/ "Jo Bole So Nihal." Clearly Islamic terror is temporary, saffron terror is permanent.	sit-down comedian | sanatana dharma passionate | jihad sauce-maker | if we meet & you don't find me pretty, you are buying me drinks until you do |	13458	1	1
7/27/2015 14:31:09	625674790309789696	Haaimbangush	RAW's plan is 2 intensify #Khalistan movement by itslf; blame Pak 4 it. India 2 exploit Sikh minorities frthr in its proxy. #GurdaspurAttack	a directionless soul, acting as research and security analyst, want to be a leader but have chosen a path to be employed. simply i am me. fb: columnist vision	469	1	1
7/27/2015 14:32:49	625675210247639041	Bhagwats143	#GurdaspurAttack Stupid PAK always involved in terrorist attacks fck off paki	civil engineer	44	1	1
7/27/2015 14:34:11	625675555438878722	Anilpyati	The #GurdaspurAttack ers screamed 'Allah hu Akbar' Good to know that these terrorists belongs to religion of peace. @asadowaisi	god has no phone, but i talk to him. he has no facebook, still he is my friend. he doesn't has twitter, yet i follow him. may god bless all :)	57	1	1
7/27/2015 14:34:15	625675569989054464	Tweetutva	if #Terrorism dosent hv any #Religion,how cum Terrorist shouting AllhaHuAkbar? #GurdaspurAttack #___ http://t.co/NqKwAEMCs5	hindu nationalist | it professional | support uniform civil code | soldier without uniform | against #lashkar_e_media | honored to be followed by @narendramodi	743	1	1
7/27/2015 14:35:13	625675817302028288	KadakChaa	The whole world needs to just finish off this Pakistani Army + ISI + Mullahs and let India and Pak civilians live in peace #GurdaspurAttack	phd student univ of tampere - #cardiac #ipsc #electrophysiology, modi supporter, tweet majorly on politics, science, sarcasm and latest events rtendorsement	977	1	2
7/27/2015 14:35:13	625675813279522817	verma_cool3012	its time to stand together rather than politicize dis issue how many more sacrifices you wann,juss kill those paki bitches #GurdaspurAttack	ι мαkє мa σwи*яυlєѕ*. ι ∂onт *caяє*ωнaт oтhєяѕ ѕαу *αßoυт* мє.	56	1	2
7/27/2015 14:35:27	625675874126458880	iKaicer	Indian Security Advisors Say This Attack Has No Links With Khalistan But Indians Are As Asual Abusing Sikhs &amp; Muslims #GurdaspurAttack	the religious secular	191	1	2
7/27/2015 14:36:07	625676041919590400	ethicalman3	Even #presstitutes sound better today.. https://t.co/EhdUaSYu1c #GurdaspurAttack	until the lions have their own historians, the history of the hunt will always glorify the hunter that's why we need a hindu narrative.	517	1	0
7/27/2015 14:36:11	625676059342606337	piyushkaul	Since News Flashed in that Attackers heard shouting Islamic Slogans #AdarshLiberal started their act #GurdaspurAttack http://t.co/IOtBPVKeHV	be with me , to explore me	644	1	1
7/27/2015 14:37:14	625676322128269314	hisubhash	#Gurdaspur Attackers heard shouting Islamic slogans before final assault http://t.co/jih86nlLED #GurdaspurAttack	subhash kumar	208	1	1
7/27/2015 14:37:42	625676438717378560	DhanushKool	#NewsTrader @BDUTT is defaming&amp;insulting Sikhs by false claim that 1of d terrorist ws a Sikh. She must retract n apologize. #GurdaspurAttack	#intolerant unapologetic hindu nationalist... it engg. | tweets while on bench | statutory warning: injurious to mental health, follow me at your own risk.	2637	1	1
7/27/2015 14:38:17	625676587128758272	redostoneage	Religion of Peace Update: #GurdaspurAttack Terrorists shouted Islamic Slogans http://t.co/bqFc2dW4JS #p2 #libcrib #nerdland #nyc	i love america. i love our constitution. i hope we return to our libertarian values!	7879	1	1
7/27/2015 14:39:25	625676873264070656	ranjithasreddy	#GurdaspurAttack look at wat paki thinks abt india.....https://t.co/VFjCZuyhZC	proud bhakt, nationalist	140	1	0
7/27/2015 14:39:32	625676899524571136	SwachhPolitics	Breaking News: Govt denies involvement of any Sikh terrorist in the #GurdaspurAttack   #___ @narendramodi	satyamev jayate @arvindkejriwal news as it happens.. http://t.co/c3sostg0as	3163	1	0
7/27/2015 14:39:56	625677003958554624	piyushkaul	Beware #AdarshLiberal on prowl #GurdaspurAttack http://t.co/IJ0lSdbLa5	be with me , to explore me	644	1	1
7/27/2015 14:40:17	625677090566746112	OnlySinghLion	Allah ho Akbar battle cry was raised by pigs killed in #GurdaspurAttack #presstitutes media will not show,because they r funded by Saudi's	son of fauji. singh by blood, not by sugar....	819	1	1
7/27/2015 14:40:26	625677126956507137	IshanMohan	no need of #enemy when u have people like him at home #GurdaspurAttack #shame Abdullahs http://t.co/SkUhIB6TJS	working in tcs	151	1	1
7/27/2015 14:40:49	625677223018766336	redostoneage	Islamic jihadists from Pakistan screaming Allahu akbar storm police station, kill six http://t.co/2ywygdENNZ #GurdaspurAttack	i love america. i love our constitution. i hope we return to our libertarian values!	7879	1	1
7/27/2015 14:41:38	625677428216758272	InsomnicDracula	End this paki shit forever. End pigistan. #GurdaspurAttack	love online wwf with assholes. do not follow me! you will be blocked!	1	1	1
7/27/2015 14:42:40	625677688812998656	redostoneage	Religion of Peace Update: #GurdaspurAttack Terrorists shouted Islamic Slogans http://t.co/bqFc2dW4JS #chicago #wgn #cltv #wbbm #pbs #npr	i love america. i love our constitution. i hope we return to our libertarian values!	7879	1	1
7/27/2015 14:43:13	625677829733249024	syed_rouhan	3 brave young sikhs got martyrdom 2day in #punjab ... punjab banke raheega #khalistan .. #GurdaspurAttack	die-hard fan of #geelani| yeah i am from that heaven which has been turned into hell #kashmir | #pakistan in my veins|#freepalestine	364	1	1
7/27/2015 14:43:24	625677875086143488	imrajeevnr	It is time India developed some appetite for war against the Pakistani jihadist state. #GurdaspurAttack	i'm the boss therefore i'm jobless/ responsible for https://t.co/1vwdkhnsyr& hell lot of others/ chelsea fc /cr7 /single doesn't mean i m available	360	1	1
7/27/2015 14:43:28	625677892769349633	1Force	Why Gurdaspur? Because it was the hotbed of Sikh militancy. Don't be surprised if they were Indian agencies' vigilante #GurdaspurAttack	activist-educator | http://t.co/ayfb0rowqo | http://t.co/scfgc5t349 | http://t.co/yt1rgp7wys	1519	1	1
7/27/2015 14:43:45	625677964789727232	channelrt	... ... could explain why home guard mistook him for sikh ... ... : @BDUTT #GurdaspurAttack https://t.co/VxTdlaBd3d	india's news channel for digital media! contact email : editor@channelrt.com	362	1	1
7/27/2015 14:43:46	625677965494472704	RajKumaravfc	No doubt, we will be seeing a lot of fake Sikh accounts, set up, by Pakistani trouble makers #GurdaspurAttack	rt what i wanttl may contain adult content#opisisbe yourself	323	1	1
7/27/2015 14:44:54	625678251789275136	rangats	Where r the psycho #AdarshLiberals those who trended #IndiaWithPakistan after #GurdaspurAttack ?	want strong india under my pm karma yogi @narendramodi . no replies to abusers	10100	1	1
7/27/2015 14:45:31	625678409113272324	Beebagr_Baluch	Pakistan is the Ground of Terrorist and ISI is the coach and players are extremist, Pak Involved terrorism in India #GurdaspurAttack	dp of my leader hyrbyair marri #balochistan liberation #humanrights activist,freedom from #pakistan & #iran ,support #india & #israel #kurds #yezidi hate #isis	6009	1	1
7/27/2015 14:46:58	625678770460954624	gururajts	@bdutt Have you figured out how to get RSS and Hindu into this terror attack? #GurdaspurAttack	army veteran (signals)	91	1	0
7/27/2015 14:48:47	625679227765981184	imbalochh	what a mindset u got casualties &amp; u r taking step to no cricket with Pakis come on indian think more than this. #TakeAction #GurdaspurAttack	activist (liberty, when it begins to root( that is youth), then that plant can grow rapid!)	1034	1	0
7/27/2015 14:48:50	625679241565200384	mayanknxt	Has @sardesairajdeep reported from the ground on #GurdaspurAttack.. Or Tyranny of Distance prevent him #presstitutes @mediacrooks		0	1	1
7/27/2015 14:49:30	625679411551997952	valmikii	Pakis are confused what to trend. Thay should trend #IslamKilledInnocents in #GurdaspurAttack	know thy self, know thy enemy. a thousand battles, a thousand victories.	1089	1	0
7/27/2015 14:49:56	625679520406712321	BreakiNews	@naqvimukhtar @kirtisaxena999 isis and paki flags in Srinagar every day, #GurdaspurAttack not a 'Tandav' for you ? Shame.	everything is on my 'photo'.	728	1	1
7/27/2015 14:50:33	625679675575046145	imbalochh	What a horrible incident and indians are demanding no crick with pakistan ..come on take strong action against paki pigs #GurdaspurAttack	activist (liberty, when it begins to root( that is youth), then that plant can grow rapid!)	1034	1	1
7/27/2015 14:50:43	625679714850590720	5dalwindersingh	Hindus blame on Khalistani for gurdaspur attack.. for Ur kind info. Khalistani never ever kill innocent people #GurdaspurAttack	father's name -guru gobind singh ji ..... ....... birth place -anandpur sahib .... ...... ........./ singh soorme motorcycle wale	22	1	1
7/27/2015 14:50:59	625679781380554753	GodlessUtopia	Islam is not a religion of peace - @Ayaan Hirsi Ali #GurdaspurAttack #Pakistan #muslims #atheist . . http://t.co/wNNv4kxfRj	a perfect world with no religion	17314	1	1
7/27/2015 14:51:58	625680030916435969	manthansoni1991	Greatest #AdarshLiberal EVER? Spinning better than warne and murli. #GurdaspurAttack @coolfunnytshirt @AshDubey_ http://t.co/xB7u913tLN	mana ki andhera ghana hai, par diya jalana kahan mana hai	59	1	0
7/27/2015 14:52:17	625680109807120385	PranavaBhardwaj	Interestingly Rashtrawadi Bhakts and Pakis were on the same side in terming #GurdaspurAttack as "Rise of Khalistan" #Shame	4-3-15    , , ,11    tweets	447	1	1
7/27/2015 14:52:58	625680280825786368	BackMinal	SO SAD NEWS.. #GurdaspurAttack #Gurdaspur #GurdaspurAwakesKhalistan #Khalistan #UN #PMModi #INDIA #BlameGameIndia #AAP #AAPwithTerrorists	i am aiman khan from pakistan.i am funny girl and i love my beautiful #pakistan	6031	1	0
7/27/2015 14:55:45	625680981517709313	iHardikBhatt	Long time back....kafir know nothing about islam @KB_Jarral #GurdaspurAttack....Muhammad was terrorist http://t.co/ruWCCIAiYy	agnostic hindu	3634	1	1
7/27/2015 14:56:14	625681106101268480	shaileshthapli	@RanaAyyub yeah only #AdarshLiberals can have opinion on everything... #Nopetitiontosign #GurdaspurAttack		37	1	1
7/27/2015 14:56:33	625681182953484288	BrahoBaloch	If Pakistan is not 2 blame 4 #GurdaspurAttack than tel me who is d inventor of Islamic militancy,slogans of Ghazwa-e-hind. #AwaranOperation	a die hard baloch nationalist, believe in no political gods. a voice for #freebalochistan.i am secular,social media activist & support all oppressed nations.	672	1	1
7/27/2015 14:56:35	625681193162256384	sp1rs	#GurdaspurAttack this is not why people voted you sir @narendramodi .... Now it's time to show pakis 56 inch chest	programmer, coder , interest in politics,chess,fan of namo	106	1	0
7/27/2015 14:56:47	625681243770720258	Fans_Bharat	One 1 hand there r people lik @BeingSalmanKhan &amp; @asadowaisi provoking Muslims. On othr hand Pak provoking Khalistanis.#GurdaspurAttack	#ghaskiroti a heart-wrenching survival story of poor farmers in bundelkhand	10594	1	1
7/27/2015 14:57:08	625681329263263744	zamuran98	If Pakistan is not 2 blame 4 #GurdaspurAttack than tel me who is d inventor of Islamic militancy,slogans of Ghazwa-e-hind. #AwaranOperation	baloch journalists forum  ex anchor of a bn tv	816	1	1
7/27/2015 14:57:30	625681423433732096	Preet_Sandhu97	@SanamBalochReal stupid pakis, we are indians and we are united, I am sikh and I love my country India. #GurdaspurAttack	cricket lover and a proud yuvi fan	13	1	1
7/27/2015 14:59:46	625681992617558016	ParagRudani	#GurdaspurAttack militants raised 'Allah ho Akbar' battle cry; Punjab police #AdarshLiberals : saffron RSS behind it #___		14703	1	1
7/27/2015 15:01:40	625682472055914496	umarahman11	Pakistan is the Ground of Terrorist and ISI is the coach and players are extremist, Pak Involved terrorism in India #GurdaspurAttack	national and the people are known by their land language and history baloch is known by balochastn & does not belong to pakistan & iran...	492	1	1
7/27/2015 15:03:23	625682905533018113	monakaran	Paki loving bollywood now better cut d bull crap of Indo-Pak friendship,stop patronising Paki Artists and sportsmen #GurdaspurAttack	a passionate nationalist hindu.rt's are not endorsements	1001	1	1
7/27/2015 15:03:52	625683026635280384	abhisheksri1984	#AdarshLiberals n Owaisi will say Army could hv caught them alive but killed due to their religion #GurdaspurAttack https://t.co/LhHyPiqqvi	nationalism is not something that you will get after a certain level of maturity, it is a sentiment...you born with it rts ≠ endorsement	37	1	1
7/27/2015 15:04:27	625683170030063616	AnchalJourno	#GurdaspurAttack is yet another tragic heinous act by people who're brainwashed by few coward extremists. I Salute brave martyrs &amp; soldiers	science/environment/space journalist, blogger: want to live till 99% world runs on clean sustainable energy & humans become a multi-planetary species	85	1	1
7/27/2015 15:05:42	625683488281210880	Deadlysikh	India's right wing is far more mature than the mature Paki journalists and Paki tv anchors. #GurdaspurAttack #Gurdaspur #IAmCait #ChargedUp	waiting for grand unified theory. i am the one who knocks©	132	1	1
7/27/2015 15:07:12	625683865776975872	EvilYindoo	So what if I can't do live reporting for ISI, I will spin that terrorists are sikhs. That's filth named @bdutt ; #GurdaspurAttack	centrist, descendant of an evil civilization that started in 7000 bc and proclaims 'har har mahadev' (everyone is great god)	4042	1	1
7/27/2015 15:08:49	625684271689109504	rahulsingh5385	It's sad that terror attacks keep on happening in our country &amp; still our countrymen talk about forgiving terrorists #GurdaspurAttack #shame	love to work,die to party. believe in karma. avid learner. opinionated. story teller. modi-fan.iota part of the talent management space. timeline is a mashup.	381	1	0
7/27/2015 15:10:21	625684656533446657	ChainsawPt2	#GurdaspurAttack is proof once again that is islamic terrorist groups are the world's most dangerous threat	american republican constitutionalist conservative patriot.united states of america. e, pluribus unum.	373	1	0
7/27/2015 15:10:39	625684733091909632	iHardikBhatt	Weekly &amp; monthly terror report of pissful cult #GurdaspurAttack yet not added. http://t.co/vbL93FBA5s	agnostic hindu	3634	1	1
7/27/2015 15:11:19	625684901661032449	ravi_rulhania	Funny how people who shout 'Hindutva goons'at every opportunity get offended when see references to 'Islamic terrorism #GurdaspurAttack	bio chhod yaar, dp dekh.	1725	1	1
7/27/2015 15:11:41	625684991641432064	jayeshbc	Pakistan is the Ground of Terrorist and ISI is the coach and players are extremist, Pak Involved terrorism in India #GurdaspurAttack	namo bhakt..working in india's biggest firm.hates. have better understanding of politics & world economy. bjp vice president.	136	1	1
7/27/2015 15:11:50	625685028559699968	JudgeWen	One place that hasn't come under the scanner is #malaysia it is one of the safest haven for Islamic terrorists. #UBL #GurdaspurAttack	child of this planet. bound by nothing. belong to nowhere & everywhere. do nothing for living. connected to all that is 'universe.'	33	1	1
7/27/2015 15:11:57	625685060579127296	Nikhil_S147	Another burning eg. of how @BBCWorld falters in reporting international news. #shame #GurdaspurAttack #Gurdaspur https://t.co/vsP66jaLC8	#phd #finance doctoral candidate @bradforduni sometimes people who no one imagines anything of, are ones who do something no one imagines follows/rt ≠ endorse	262	1	0
7/27/2015 15:13:37	625685478222639108	lycan786	Kudos to Punjab Police n commondos to crack down Islamic Terror #GurdaspurAttack	media logics exposed | freedom of speech : you abuse me, i abuse you | pen against gun | fact against faith | and yes secular not sikular |	255	1	1
7/27/2015 15:13:55	625685554663788544	kush07	REMEMBER this Anything #Presstitutes would Say/ Imply/ Plant about #GurdaspurAttack as news would be a lie Example https://t.co/Bvhcpp6pl0	opinions do matter. what is told to you is almost never the truth. use those grey cells to figure out the truth.	2762	1	1
7/27/2015 15:15:26	625685936555233280	ranjantch	#GurdaspurAttack is proof once again that is islamic terrorist groups are the world's most dangerous threat and terrorist born in only pak.		9	1	1
7/27/2015 15:17:49	625686535745056768	vinkumadhok	I'm envy of paki as they got such neutral news agencies unlike #presstitutes in Indian journalism. #GurdaspurAttack https://t.co/2FvvvHlXXq	my tweets r my own viewpoints so dont judge me but plz follow me. my mission to see #namo4pm achieved. my inspiration namo, following me on twitter	6664	1	1
7/27/2015 15:19:54	625687058233737216	iHardikBhatt	Wherever terrorist incident happened nothing wrong in blaming #Islam/Moslem....... In 99.9% you never failed. #GurdaspurAttack	agnostic hindu	3634	1	1
7/27/2015 15:20:08	625687119780950016	kush07	Hey @BDUTT by any chance is the Home Guard is named Ankit the 2nd? #JustAsking #Presstitutes #GurdaspurAttack https://t.co/GwzVXipwGU	opinions do matter. what is told to you is almost never the truth. use those grey cells to figure out the truth.	2762	1	0
7/27/2015 15:20:12	625687137178906624	anuraag_saxena	Apparently 1 terrorist has been caught alive. Human-rights activists &amp; #AdarshLiberals just found fodder for the next year #GurdaspurAttack	centrist, nationalist, bollywoodist!!! rt are not endorsements. but maybe they are! :-)	225	1	0
7/27/2015 15:23:46	625688034395095046	bLazyThinkCrazy	Terrorism has no religion unless Terrorist is Non-Muslim, Moron @BDUTT mentioned "Sikh". #GurdaspurAttack http://t.co/0m3EkK4NCG	5 billion years ago,nehru made an appearance. after that, he created the earth! note:reply doesn't necessarily mean bhaaw() and like(favorite) doesn't mean	434	1	1
7/27/2015 15:24:28	625688207301042176	prasad_prateek	not an attack by pakistan but muslims,terrorist= Muslim &amp; their ideology, beware of these vilest animals nearby,be prepared #GurdaspurAttack	a #hindu nationalist, hardcore ufc fan, kind heart, will follow back likemindeds only, #sickular stay away	186	1	1
7/27/2015 15:24:44	625688278172200960	YaminiSachar	#GurdaspurAttack terrorism has no religion! strict actions r needed against terrorism not Pakistan....		47	1	2
7/27/2015 15:25:21	625688432342269952	rinku67	@FarisAliKhan2 @rasikh87 guys..these pakis needs lesson.#GurdaspurAttack	a doctor who wants to cure patients and society of bad aliments.	59	1	1
7/27/2015 15:29:03	625689361531572225	bLazyThinkCrazy	Why didn't this moron @BDUTT mention the religion of terrorist who was shouting "Allah hu akbar" ?? #GurdaspurAttack http://t.co/pAXbAvJsD5	5 billion years ago,nehru made an appearance. after that, he created the earth! note:reply doesn't necessarily mean bhaaw() and like(favorite) doesn't mean	434	1	1
7/27/2015 15:31:04	625689872179687426	Soumitradas4Das	@ArvindKejriwal goes with Z+ security "Thullas" while 8 cops dead in #GurdaspurAttack #presstitutes @ndtv @ibnlive @aajtak will not ask AK?		110	1	1
7/27/2015 15:35:50	625691068428726272	IndusSpirit	#GurdaspurAttack above all virtues APJ Abdul Kalam is not a bigot at first place!	i m proud #modi ji following me since 3+ yrs speaker-nationalist, activist; hr 4 #hindus- anti pseudos--cfts- writer, poet, travel hindu ism-rt's r not favors	4191	1	0
7/27/2015 15:36:28	625691227921346560	wittysoul_me	These Pakis r left with no work except attacking India every now n den. #GurdaspurAttack They should change d country name to Aatankistan	i am a princess | i believe in loyalty & trust | i think standing up 4 myself is important | i think standing up 4 others is more important | i am a princess ♥	1051	1	1
7/27/2015 15:39:22	625691957294051329	rajpatimishra	#GurdaspurAttack Few years back I was on pathankot gurudaspur amritsar route by Car fm man vaishnow devi.Pained to see attack by pakis here	b. tech (cse) , pgdba(marketing), ace npcil ,swayamsevak,desire to search truth	76	1	1
7/27/2015 15:43:25	625692978485407745	m9maru	@ianuragthakur u a fucking paki sympathiser, corrupt either quit BCCI or politics u #GurdaspurAttack	agnostic rts not endorsements 'life doesn't get easier, you just get stronger'.	32	1	0
7/27/2015 15:52:59	625695384736628736	m9maru	@BJPRajnathSingh u still want to talk with Pakis &amp; we voted u for this, resign &amp; join AmankiAsha @rajuparulekar #GurdaspurAttack	agnostic rts not endorsements 'life doesn't get easier, you just get stronger'.	32	1	1
7/27/2015 15:53:39	625695553356083204	hkhan2000	Meanwhile #India busy with blame game and #Sikhs of India posting such Pics #GurdaspurAttack #Gurdaspur https://t.co/l8aj6Xjj8L	an ordinary human being !!	239	1	0
7/27/2015 15:56:13	625696200679776256	anandserrao	To All Pakis who applaud #GurdaspurAttack your hate will be your undoing and the poisonous snakes you harbor will enjoy your dead country	fried head with a dried humor a true devil's advocate die-hard indian sports fan, tweets are in personal capacity	106	1	1
7/27/2015 15:56:34	625696286046425088	beardsingh	I happy to say all The indian people criticised @BDUTT for disgusting tweets on sikh..she is a terrorist #shame #GurdaspurAttack	sikh	886	1	0
