7/27/2015 9:43:29	625602396551417856	tufailelif	#GurdaspurAttack This is a known enemy: At this point, Hafiz Muhammad Saeed is recruiting jihadists in Burmese refugee camps of Indonesia.	author and commentator on south asian current affairs; ex-bbc journalist, countering everyday islamism; views grounded, rts  endorsement.	11359	1	1
7/27/2015 9:44:00	625602526453174272	jassi678	#GurdaspurAttack Support our troops to fight this evil named terror. Terror has no religion, so the terrorist. Kill them. @IndianExpress	success comes from struggle.	330	1	0
7/27/2015 9:46:28	625603147528941568	kush07	#Pakis wouldn't want another #AjmalKasab #GurdaspurAttack will directly get linked to #Pakis if we get hold of a #TerrorRat	opinions do matter. what is told to you is almost never the truth. use those grey cells to figure out the truth.	2763	1	0
7/27/2015 9:47:37	625603439209230336	NasirAK786	Real face of Hindu terror unleashed! #Gurdaspur #GurdaspurAttack #ModiAttacksGurdaspur http://t.co/5q2hi0RCa2	ml, poo, love p ary, pd  troll ido d ldo. p zdd	442	1	0
7/27/2015 9:48:39	625603699453263872	tufailelif	#GurdaspurAttack Know your enemy: Pakistani military's ISI is a global jihadist organization. Every security analyst knows. #ISI	author and commentator on south asian current affairs; ex-bbc journalist, countering everyday islamism; views grounded, rts  endorsement.	11359	1	1
7/27/2015 9:50:39	625604201150713856	tufailelif	#GurdaspurAttack In 1999, the Pakistan state hijacked Indian Airlines plane IC814 to Kandahar, and we blame it on some innocent jihadists.	author and commentator on south asian current affairs; ex-bbc journalist, countering everyday islamism; views grounded, rts  endorsement.	11359	1	1
7/27/2015 9:51:58	625604531158544384	tufailelif	#GurdaspurAttack We honoured General Pervez Musharraf, the architect of Kargil war, arguably the biggest jihadist war against India.	author and commentator on south asian current affairs; ex-bbc journalist, countering everyday islamism; views grounded, rts  endorsement.	11359	1	1
7/27/2015 9:53:32	625604925490200578	tufailelif	#GurdaspurAttack Tell the US ambassador in New Delhi: your government is arming a jihadist state on our borders with money and weapons.	author and commentator on south asian current affairs; ex-bbc journalist, countering everyday islamism; views grounded, rts  endorsement.	11359	1	1
7/27/2015 9:53:56	625605026648461312	MediaVsIndia	I'm sad, instead of being upset over #GurdaspurAttack, our #BJP speaker is upset with a random #congressi! #Shame https://t.co/WVohiyPFvM	indian media is india's enemy no. 1. sooner you understand, better. formerly @tweet_mit.	5020	1	1
7/27/2015 9:55:57	625605534335397888	vishuspeaks	#GurdaspurAttack is a cowardly act by Pakis. @manoharparrikar Lifes Sacrificed by Martyrs Shouldn't Go Unnoticed. Nail these terrorists ASAP	research analyst @firstrain | volunteer @himachalhotspot @himachalw @searchdonors @thenewsnow24 my nation, my pride; life is open, nothing to hide	194	1	1
7/27/2015 9:55:59	625605545492267008	Samsara4747	So Muslim terrorists have succeeded in killing more Indians #GurdaspurAttack RIP	hindu nationalist,a follower of advaita vedanta	538	1	1
7/27/2015 9:56:58	625605792805163008	chintanmistry4	Terrorism : a cowardly activities from cowards.!! #shame. #GurdaspurAttack	love to read poems #bollywoodlover #movieholic sc: chintiiee_snaps ig: chintiiee	289	1	1
7/27/2015 9:59:36	625606452334366724	RobilSingh	#Shame Our politicians are busy in fighting with each other while our Jawans are fighting with deadly terrorists #GurdaspurAttack #Gurdaspur	|software engineer|politics|sports| @narendramodi | #atlticodekolkata #barca #chelsea #kxip #mi |social freedom| born rajput but atheist|	395	1	1
7/27/2015 10:02:06	625607081270231040	tufailelif	#GurdaspurAttack Indian people stand with the people across the border, not with the jihadist state of Pakistan. ISI is a jihadist group.	author and commentator on south asian current affairs; ex-bbc journalist, countering everyday islamism; views grounded, rts  endorsement.	11359	1	1
7/27/2015 10:04:41	625607732238811137	puruohit	#GurdaspurAttack In 1999, the Pakistan state hijacked Indian Airlines plane IC814 to Kandahar, and we blame it on some innocent jihadists.	,	168	1	1
7/27/2015 10:05:12	625607865043017728	tufailelif	#GurdaspurAttack It is time a private website started publishing the names of Indian soldiers and policemen killed in jihadist attacks.	author and commentator on south asian current affairs; ex-bbc journalist, countering everyday islamism; views grounded, rts  endorsement.	11359	1	0
7/27/2015 10:08:15	625608629882761216	puruohit	#GurdaspurAttack Do not forget: The United States is arming the jihadist state of Pakistan with money and weapons.	,	168	1	1
7/27/2015 10:09:57	625609058842640389	sammyroy85	#Shame Our politicians are busy in fighting with each other while our Jawans are fighting with deadly terrorists #GurdaspurAttack #Gurdaspur	fighter, proud indian. win or lose i am always #mufc fanatic. everyone's friend!!	104	1	0
7/27/2015 10:11:12	625609371523772416	tufailelif	#GurdaspurAttack Hafiz Muhammad Saeed of Lashkar-e-Taiba is recruiting jihadists among Palestinians in Gaza and Burmese camps in Indonesia.	author and commentator on south asian current affairs; ex-bbc journalist, countering everyday islamism; views grounded, rts  endorsement.	11359	1	1
7/27/2015 10:14:57	625610315841994752	imSachin_alive	#shame..u r still busy in playing politics n making stupid allegations in parliament on such a sensitive issue?? @INCIndia #GurdaspurAttack		14	1	0
7/27/2015 10:15:15	625610394187337728	IndiObjectivist	Pakis, Say good bye to #baluchistan .Remember, @narendramodi neither forgets nor forgives. #GurdaspurAttack #Punjab #ModiAttacksGurdaspur	an objectivist, realist,exposing the leftist propaganda everyday. a is a	29	1	0
7/27/2015 10:15:30	625610455692677120	puruohit	#GurdaspurAttack This is a known enemy: At this point, Hafiz Muhammad Saeed is recruiting jihadists in Burmese refugee camps of Indonesia.	,	168	1	1
7/27/2015 10:16:04	625610598278021120	puruohit	#GurdaspurAttack Indian people stand with the people across the border, not with the jihadist state of Pakistan. ISI is a jihadist group.	,	168	1	1
7/27/2015 10:20:38	625611747198545920	impbhatt	There r 3types of terrorists .Khalistan terrorists ,saffron terrorist and terrorists who have no religion #GurdaspurAttack #MaiBhiLiberal	i am a certified intolerant.	53	1	1
7/27/2015 10:26:07	625613125279219712	simbamara	#GurdaspurAttack Hafiz Saeed of Lashkar-e-Taiba is recruiting jihadists among Palestinians in Gaza &amp; Burmese camps in Indonesia.@tufailelif	freespirit, nature lover,gourmet traveller,linguist,art promoter,real politics.proud hindu.investment analyst..retweets not personal views	3334	1	1
7/27/2015 10:26:49	625613302769389568	AninBanerjeeeee	@IYC targets @PMOIndia while protesting #GurdaspurAttack ! Even on such a day politics is at heart of it. Could hv waited 24 hrs. #shame	i report for india today television. but all tweets are solely mine and not of my employer. i mean it. and i don't endorse thru rts.	106	1	0
7/27/2015 10:27:14	625613407107031040	SirZaidHamid	By killing terrorists in #GurdaspurAttack are we not becoming like terrorists themselves? Thoughts of #AdarshLiberals	guardian angel of pakistan army and isi. mission takmeel-e-pakistan and ghazwa hind. personal advisor to general raheel sharif.	22756	1	1
7/27/2015 10:31:07	625614385084432384	Murali_Bekkam	@ShainaNC Madam say something about #GurdaspurAttack other wise Congis and other #AdarshLiberals would attack you for doing yoga		19	1	0
7/27/2015 10:31:16	625614421407076353	yuktiyukta	Kill all terrorists. If caught alive one day #AdarshLiberals will sign mercy petitions fr thm. #GurdaspurAttack	forever student, massachusetts ins of technology, virginia tech, interested in science, politics, philosophy, proud hindu	108	1	1
7/27/2015 10:31:56	625614592396300288	Rajender_Shimla	#GurdaspurAttack Every Indian stands up whenever there is an attack on the sovereignty &amp; integrity of India. So why this #AAPwithTerrorists?	an #indian,#pahari #himachali,#itprofessional, #internetexpert,#webadvisor,#onlinebusinesses,#socialist,#freelancer	1635	1	0
7/27/2015 10:32:53	625614830846636032	rite2ankit	#GurdaspurAttack shows why terror has one religion	helping #startups #entrepreneurs globally in enhancing #business	907	1	1
7/27/2015 10:35:13	625615416983986176	paramchahal_	but what can we expect from a country that kill their own people shameless pakis trending absurd. #GurdaspurAttack	studying medicine india first retweets not endorsments tweets not intended to hurt anyone	7	1	1
7/27/2015 10:36:47	625615811072241666	IdamRashtray	perhaps some #AdarshLiberals hv started 2write letter 4 safe passage 2 terrorists from blood thirsty security forces..#GurdaspurAttack	proud father of an angel..author of understanding hinduism...   ,  ,  ..	577	1	1
7/27/2015 10:37:49	625616069470752768	nitinsjog_ngp	#GurdaspurAttack #AdarshLiberals gear up for the next 'SaveThe Terrorist' mission. http://t.co/reM4gjnilL	consulting engineer in water infrastructure. fed up with suspect indian politicos and paid media.	52	1	1
7/27/2015 10:40:02	625616627829092353	some_indian	Stmt condmng encntr deaths &amp; Mercy petition for alive -both ready. #AdarshLiberals wtng fr outcome #GurdaspurAttack https://t.co/VW0wpIYbAm	~ some indian, some of us &nbsp; ~ opp of adharm is dharm : dharm is sanatan &nbsp; ~ i came, i saw, i rted	938	1	1
7/27/2015 10:40:17	625616690756325376	Miss__mamta	Now jst watch how mny seculars showing sympathy on #gurjeetsingh,ssp who ws killed in #gurdaspurattack &amp; hw mny in fevour f hang ban	modified,moody,foodie,filmy ,dreamy,love nature, humour,best rt u find here,love2learn,egalitarian insprsn- @sambitswaraj (krishna) rt=endorse	121	1	1
7/27/2015 10:40:23	625616717188853760	paramchahal_	if we had said that attack on children Peshawar was carried by pakis themselve how u would hv reacted shameless pakis #GurdaspurAttack	studying medicine india first retweets not endorsments tweets not intended to hurt anyone	7	1	1
7/27/2015 10:40:48	625616820402319360	NeelakshiGswm	8 innocent killed by jihadis in #GurdaspurAttack... The terrorist apologists shd be out now crying victim #Gurdaspur	#pandit| #assam #kashmir #proisrael | dr @swamy39 bhakt | followed by 200+ verified media/political personalities across d world & blocked by rats.	25912	1	0
7/27/2015 10:41:15	625616936336887808	aniksahaonline	after the #GurdaspurAttack ,some separatist groups are trying to induce the Khalistan issue.DON'T LISTEN TO THEM INDIANS. #unitedWeStand	a proud indian.a writer.preacher of #mattersofinstinct and #besafe and trending tweets.admin of http://t.co/svkdqaljzp . a wattpader at http://t.co/judi2cjxy0	402	1	1
7/27/2015 10:43:16	625617441452769280	thekernelspeaks	Good deal ... u #presstitutes @sardesairajdeep @IndiaToday @aajtak must be slapped on sight without any Due diligence. #GurdaspurAttack	staunch right wing hindu with blood group #rss positive	4888	1	1
7/27/2015 10:45:37	625618036133724160	ankitcktd	By killing terrorists in #GurdaspurAttack are we not becoming like terrorists themselves? Thoughts of #AdarshLiberals	मौन भले हो जाऊं पर गौण नही हो सकता हूँ	390	1	0
7/27/2015 10:49:52	625619103265329152	sumitmishra11	Stupids Bringing a Religious angle In #Gurdaspur nd Questioning Sikhs on #GurdaspurAttack I Let U Understnd Dey R Biggest Patriots of India	शिवभक्त,nationalist, curse media if you ever find me biased, rw's,armchair critique न त्वेवार्यस्य दासव: followed by @girirajsinghbjp @upadhyaysbjp & @byadavbjp	397	1	1
7/27/2015 10:50:35	625619285595918336	ncsradvocate	#GurdaspurAttack will shut ugly secular mouths, Yakoob will b hung, no force will come to his rescue	country first, family next, self last, neither gandhian nor secular, never voted for cong, no god fathers, i hate invaders' legacy, regional chuavanists	122	1	0
7/27/2015 10:51:41	625619561476272128	some_indian	In the meanwhile #AdarshLiberals finding a way to link/ blame on RSS/ Modi.Won't be surprised if such attempts made. #GurdaspurAttack	~ some indian, some of us &nbsp; ~ opp of adharm is dharm : dharm is sanatan &nbsp; ~ i came, i saw, i rted	938	1	1
7/27/2015 10:52:48	625619840166838274	ncsradvocate	#GurdaspurAttack will be a great chance to eliminate rogue islamic state Pakistan, heart throb of many secular Indians	country first, family next, self last, neither gandhian nor secular, never voted for cong, no god fathers, i hate invaders' legacy, regional chuavanists	122	1	1
7/27/2015 10:53:08	625619924535377920	pkkush64	indian #presstitutes must be happy that no innocent terrorist has been killed yet by the demonic police forces #GurdaspurAttack	#congressmuktbharat #sanskrit and #hinduism. rts are not endorsement. if you like my tweets without rt, i may block or unfollow you.	1544	1	1
7/27/2015 10:53:30	625620019347615744	aniksahaonline	after the #GurdaspurAttack ,some separatist groups are trying to induce the Khalistan issue.DON'T LISTEN TO THEM... http://t.co/UPPFSDyIrr	a proud indian.a writer.preacher of #mattersofinstinct and #besafe and trending tweets.admin of http://t.co/svkdqaljzp . a wattpader at http://t.co/judi2cjxy0	402	1	1
7/27/2015 10:54:31	625620273715355648	pkkush64	The #AdarshLiberals are happy that no innocent terrorist has got killed because of demonic police forces #GurdaspurAttack	#congressmuktbharat #sanskrit and #hinduism. rts are not endorsement. if you like my tweets without rt, i may block or unfollow you.	1544	1	1
7/27/2015 10:55:05	625620416791326720	aniksahaonline	after the #GurdaspurAttack ,some separatist groups are trying to induce the Khalistan issue.DON'T LISTEN TO THEM . #unitedWeStand #IndiaIs1	a proud indian.a writer.preacher of #mattersofinstinct and #besafe and trending tweets.admin of http://t.co/svkdqaljzp . a wattpader at http://t.co/judi2cjxy0	402	1	1
7/27/2015 10:55:25	625620501566611456	sgangopadhyay	The #GurdaspurAttack is done by the people from "Religion of Peace" also known by the name #Islam.	entrepreneur, rss स्वयंसेवक, biochemistry nerd. cisco & linux guru. cheese aficionado. tweets are personal. official suman gangopadhyay	2015	1	1
7/27/2015 10:58:30	625621278326521856	FarisAliKhan2	Freedom Fighters of #Khalistan have killed Hindus enemies. Well done, We'are with Freedom Fighters of #GurdaspurAttack #LiberateKhalistan	a patriot. love pak sarzameen. striving to defeat enemy's propaganda against pakistan in cyber war. liberation of palestine, khalistan & freedom of kashmiris.	3121	1	1
7/27/2015 10:58:47	625621346798546944	Tasmayi	@ShekharGupta Wow ... whats next ? #Presstitutes want @VinodKhanna to nab all the terrorists ? Next will u blame Modi for #GurdaspurAttack ?	only when v realize the 1300 yrs of brutal islamic invasions can v b true nationalists	589	1	1
7/27/2015 11:00:23	625621752039673858	ParagRudani	Already drafted Tweet by @BDUTT @sagarikaghose @kavita_krishnan @_sabanaqvi &amp; @RanaAyyub "TERROR HAS NO RELIGION" #GurdaspurAttack		14703	1	0
7/27/2015 11:01:49	625622111319515136	FarisAliKhan2	#GurdaspurAttack is not a terrorism activity at all, Khalistan Freedom Fighters are fighting to #LiberateKhalistan. #ModiAttacksGurdaspur	a patriot. love pak sarzameen. striving to defeat enemy's propaganda against pakistan in cyber war. liberation of palestine, khalistan & freedom of kashmiris.	3121	1	0
7/27/2015 11:02:02	625622163807076352	kalpajitgogoi2	India shld put pressure on UK &amp; Canada which fast becoming playing ground for Sikh terrorist organisation &amp; its patron ISI #GurdaspurAttack	sports & foreign affairs enthusiast. mba, self employed. hindu by birth, indian by heart	216	1	1
7/27/2015 11:02:32	625622290688913409	sgangopadhyay	With today's #GurdaspurAttack I am wondering @DrGPradhan that is #Id celebrations still going on by people from "religion of Peace" ?	entrepreneur, rss स्वयंसेवक, biochemistry nerd. cisco & linux guru. cheese aficionado. tweets are personal. official suman gangopadhyay	2015	1	1
7/27/2015 11:03:18	625622486239965184	zameer_asim	#GurdaspurAttack kill these paki bastard..namo do something..!!		0	1	1
7/27/2015 11:03:40	625622577818374144	Minni2r	Pakistan is spilling its jihad shit on neighbors. #GurdaspurAttack	sociology analyst, engineer, history freek.	36	1	1
7/27/2015 11:05:41	625623084188315648	bararbhai	Hilarious We cannot arrest Bukhari, Owaisi &amp; Separatists and we expect Pakistan to arrest Tiger Memon &amp; Dawood for us! #GurdaspurAttack	mechanical engineer studied at govt. engineering college bikaner b.tech 2008-12	12	1	1
7/27/2015 11:06:25	625623270574809088	KuchBhiBolega	The disclaimer in @BeingSalmanKhan 's #BajrangiBhaijaan that all characters are fictitious was for Paki dogs. #GurdaspurAttack @BolshoyBooze	college mein bio paper nahi likha..toh ab kya ghantaa bio likhoonga! screw religion. screw politics. screw media.	47	1	0
7/27/2015 11:06:51	625623380054704128	golive09	#AAPwithTerrorists and therefore can't point fingers @ their own family??? #GurdaspurAttack https://t.co/scvXeI8SB2	hindu,patriot,a staunch bjp supporter,a loyalist of namo	99	1	0
7/27/2015 11:07:50	625623625014468608	KuchBhiBolega	Disclaimer in @BeingSalmanKhan 's #BajrangiBhaijaan that all characters are fictitious was for Paki dogs. #GurdaspurAttack @balliawalebaba	college mein bio paper nahi likha..toh ab kya ghantaa bio likhoonga! screw religion. screw politics. screw media.	47	1	0
7/27/2015 11:10:51	625624386603630593	Ghajinikanth	26/7 = Mumbai Terror Attack 27/7 = #GurdaspurAttack #shame #sad	chair thinker, arm wrestler, exclusive funny writer and believing in live life rajnikanth style. udta teer and mere tweets kabhi bhi lag sakte hai,bachke rahiyo	1180	1	0
7/27/2015 11:11:00	625624421529575424	thekernelspeaks	Can #Presstitutes @sardesairajdeep &amp; Italian dogs @JhaSanjay stop poking their Nose in this attack on Our India #GurdaspurAttack	staunch right wing hindu with blood group #rss positive	4888	1	0
7/27/2015 11:12:58	625624916117712896	mehyer	Has #Bhai, the 40 petitioners,Commie Bastards &amp; innumerable #presstitutes tweeted about #GurdaspurAttack yet or r they preparing petition?	wannabe social commentator, armchair activist. believes change is constant. rt's do not imply endorsement.	405	1	1
7/27/2015 11:13:01	625624931762438144	Pr1ncejerry	They way Indian extremists using politics &amp; religions against minorities one day India will lose all states like 1947. #GurdaspurAttack	#wanttoworkforcauses attended #azadimarch(byday1) #ikluvr #rajput #lastminuteguy#luvrominsect #mba #nust #luv@iamsrk #filmmaking #writer #moviesenthusiastic	409	1	0
7/27/2015 11:13:22	625625018668445696	nittin_	Before seculars preach again dat terror has no religion #GurdaspurAttack http://t.co/VxUDOFJvD3	adventurous, courageous, versatile, lively, positive, passionate, arrogant, stubborn, impulsive and confrontational.hindu nationalist	644	1	0
7/27/2015 11:14:27	625625292392919040	FarisAliKhan2	Some facts for #GurdaspurAttack. Actually #ModiAttacksGurdaspur Sikhs have a right of freedom. #LiberateKhalistan http://t.co/bpsb39tlOk	a patriot. love pak sarzameen. striving to defeat enemy's propaganda against pakistan in cyber war. liberation of palestine, khalistan & freedom of kashmiris.	3121	1	1
7/27/2015 11:17:22	625626024840007680	Raamruturaj	#GurdaspurAttack These Pigs are --- Traitors of Common Man # Traitors of Hindus # Traitors of India # http://t.co/N5cBVm9B3l		9	1	1
7/27/2015 11:19:56	625626669244530692	aniksahaonline	@realpreityzinta after #GurdaspurAttack ,some separatist groups are trying to rise the Khalistan issue.DON'T LISTEN TO THEM.# #IndiaIs1	a proud indian.a writer.preacher of #mattersofinstinct and #besafe and trending tweets.admin of http://t.co/svkdqaljzp . a wattpader at http://t.co/judi2cjxy0	402	1	0
7/27/2015 11:20:39	625626852552368128	schandrashekha4	Since 47 country facing Islamic radicals sponsored by pak now its time to hit hard not speak #GurdaspurAttack		3	1	1
7/27/2015 11:21:41	625627109549932544	aniksahaonline	@priyankachopra after #GurdaspurAttack ,some separatist groups are trying to rise the Khalistan issue.DON'T LISTEN TO THEM.# #IndiaIs1	a proud indian.a writer.preacher of #mattersofinstinct and #besafe and trending tweets.admin of http://t.co/svkdqaljzp . a wattpader at http://t.co/judi2cjxy0	402	1	0
7/27/2015 11:23:02	625627452782477312	aniksahaonline	@zakka_jacob after #GurdaspurAttack ,some separatist groups are trying to rise the Khalistan issue.DON'T LISTEN TO THEM.# #IndiaIs1	a proud indian.a writer.preacher of #mattersofinstinct and #besafe and trending tweets.admin of http://t.co/svkdqaljzp . a wattpader at http://t.co/judi2cjxy0	402	1	0
7/27/2015 11:23:18	625627518142263296	amitakjain	if police had killed #GurdaspurAttack terrorists b4 they cud attack then cong n aap wud have protested with candle march #aapwithterrorists	profile    !        , follow     ! (biologic+emotion+intellectu)aly indian	1834	1	0
7/27/2015 11:23:27	625627555677081601	g7ayush	All Jihadis Killed. #GurdaspurAttack	dharmic | nationalist | kafir | military enthusiast | tweets about politics, culture & religion	194	1	1
7/27/2015 11:23:50	625627652951425024	aniksahaonline	@shivaroor after #GurdaspurAttack ,some separatist groups are trying to rise the Khalistan issue.DON'T LISTEN TO THEM.# #IndiaIs1	a proud indian.a writer.preacher of #mattersofinstinct and #besafe and trending tweets.admin of http://t.co/svkdqaljzp . a wattpader at http://t.co/judi2cjxy0	402	1	0
7/27/2015 11:24:45	625627881662750720	anshul_surolia	keep defending terrorists, keep signing mercy petitions for dem &amp; ; dey'll keep showing their love like dis! #Shame #GurdaspurAttack	dont think for a second that i actually care what you have to say	128	1	1
7/27/2015 11:26:24	625628299964780544	aniksahaonline	@mikasingh after #GurdaspurAttack ,some separatist groups are trying to rise the Khalistan issue.DON'T LISTEN TO THEM.# #IndiaIs1	a proud indian.a writer.preacher of #mattersofinstinct and #besafe and trending tweets.admin of http://t.co/svkdqaljzp . a wattpader at http://t.co/judi2cjxy0	402	1	0
7/27/2015 11:26:25	625628303085273088	SouleFacts	Muslim terrorist in #GurdaspurAttack https://t.co/1VCQj0QcFn	nationalist, proud indian & hates traitor, allergic to scent of ittar. follow me at ur own risk, i explode frequently & not worth following.no personal question	19710	1	1
7/27/2015 11:26:31	625628327168966656	nitluc91	#GurdaspurAttack SHOOT THEM orelse remember secular s and owaisi's will start playing the religion card ...........	i am simple&cool so never forget me	22	1	1
7/27/2015 11:26:33	625628336128004096	karannkapoor18	The people who attacked today in #GurdaspurAttack are suffering Muslims taking revenge for Babri Masid ... #TweetlikeSecularJamat Bastards	life is fun for those who know, how to celebrate it in pain. https://t.co/yjisuqojht	24366	1	1
7/27/2015 11:26:55	625628425898737664	aniksahaonline	@drramansingh after #GurdaspurAttack ,some separatist groups are trying to rise the Khalistan issue.DON'T LISTEN TO THEM.# #IndiaIs1	a proud indian.a writer.preacher of #mattersofinstinct and #besafe and trending tweets.admin of http://t.co/svkdqaljzp . a wattpader at http://t.co/judi2cjxy0	402	1	0
7/27/2015 11:27:01	625628453606285312	Mohan_Gorana	The Team Is AllOut. Islamic Terrorist Pig Killed by Army. On way to get 72 Hoors. squint emoticon #GurdaspurAttack http://t.co/PO5CzdAS0j		62	1	1
7/27/2015 11:27:30	625628575006261248	aniksahaonline	@httweets after #GurdaspurAttack ,some separatist groups are trying to rise the Khalistan issue.DON'T LISTEN TO THEM.# #IndiaIs1	a proud indian.a writer.preacher of #mattersofinstinct and #besafe and trending tweets.admin of http://t.co/svkdqaljzp . a wattpader at http://t.co/judi2cjxy0	402	1	0
7/27/2015 11:28:34	625628842896396288	officeofPaGa	#GurdaspurAttack disproves Paki theorem of Muslim Superiority, 1 muslim &lt;&gt; 11 non-muslims. Better luck next time	follow @officeofrg for real humor. this is parody.	6334	1	1
7/27/2015 11:28:51	625628913851629568	tushar121212	#GurdaspurAttack - Gurdaspur attackers heard shouting Islamic slogans: http://t.co/cTUbkEbjdF	finance professional interest in economics & politics. proud indian & feels nation above all.	290	1	1
7/27/2015 11:28:54	625628926480519168	aniksahaonline	@livemint after #GurdaspurAttack ,some separatist groups are trying to rise the Khalistan issue.DON'T LISTEN TO THEM.# #IndiaIs1	a proud indian.a writer.preacher of #mattersofinstinct and #besafe and trending tweets.admin of http://t.co/svkdqaljzp . a wattpader at http://t.co/judi2cjxy0	402	1	0
7/27/2015 11:28:55	625628929278083072	Freakoh	All jihadis have been sent to Jannat. Good job Punjab Police. The officers who sacrificed their lives, may Rest in Power. #GurdaspurAttack	t-800 by heart. t-1000 by brain. if you get the reference, we will get along.	1414	1	0
7/27/2015 11:31:25	625629558914445312	aniksahaonline	@sdsanddunes after #GurdaspurAttack ,some separatist groups are trying to rise the Khalistan issue.DON'T LISTEN TO THEM.# #IndiaIs1	a proud indian.a writer.preacher of #mattersofinstinct and #besafe and trending tweets.admin of http://t.co/svkdqaljzp . a wattpader at http://t.co/judi2cjxy0	402	1	0
7/27/2015 11:32:14	625629767904006149	biharmerijaan	#GurdaspurAttack Army heard shouting Islamic slogans.Sorry #BraveHearts No one will listen U in Secular India http://t.co/s2BPeXQRjt		27	1	1
7/27/2015 11:32:14	625629764301094912	PrafullaCTiwari	Some burnol moment for our #Libtards https://t.co/7LJ4zUpov4 #GurdaspurAttack	staunch supporter of pm modi. believe in good governance and policies. free market supporter and socialism sucks.	524	1	0
