7/27/2015 11:32:44	625629890285432832	aniksahaonline	@kunalkohli after #GurdaspurAttack ,some separatist groups are trying to rise the Khalistan issue.DON'T LISTEN TO THEM.# #IndiaIs1	a proud indian.a writer.preacher of #mattersofinstinct and #besafe and trending tweets.admin of http://t.co/svkdqaljzp . a wattpader at http://t.co/judi2cjxy0	402	1	0
7/27/2015 11:33:32	625630091733635072	AeyHalkat	When the #GurdaspurAttack #terrorists are dead, I so want faces of #Presstitutes @BDUTT @sagarikaghose &amp; others superimposed on those bodies	why so serious? not here to please you. 18+ bbm:564cebab	492	1	1
7/27/2015 11:34:01	625630214358372352	greatrebellion2	@FarisAliKhan2 U SUPPORT KHALISTAN? THAN Y DONT U ASK UR GOVERNMENT TO FREE NANKANASAHIB #GurdaspurAttack #LiberateKhalistan		5	1	0
7/27/2015 11:34:16	625630277826510849	Damini_B	Every time we trust their religion of "Peace" They come with another terrorist attack. #GurdaspurAttack	learner / coffee lover / law student / dreamer / argumentative /life-lover / sagittarius	89	1	1
7/27/2015 11:34:21	625630300366852096	mkaeel	@kunalkohli india have more then 32 separatist movements including #KhalistanMoment what makes you think its Pakistan? #GurdaspurAttack	nachos,chicken and pleasant people,movie and music geek and hardcore pti....ex info sec. isf karachi,ex gen. sec. isf dist. central & unicef. what else???	196	1	0
7/27/2015 11:35:15	625630526288715776	awanishr	India can fight Pakistani Jihadists only when it develops the ball to fight internal Jihadis #GurdaspurAttack https://t.co/2x0PWgMeUm	#history #theology #finance #economics #startups	507	1	1
7/27/2015 11:35:56	625630698431328256	prthecool55	Instead of showing sympathy and feeling ashamed Pakistan is trying provoke sikhs. Shame on Pakistan #GurdaspurAttack	some people say i m awesome..	24	1	1
7/27/2015 11:36:16	625630781918937089	OneCanOnlyBeOne	#GurdaspurAttack Terror attacks for religions for the community and trust no God of any community wants it. #ShameOnYou so called religions	one can only be one	1296	1	2
7/27/2015 11:37:21	625631053382692864	TechieGuy_12	Every time we trust their religion of "Peace" They come with another terrorist attack. #GurdaspurAttack	| a kattar hindu |it engineer|techie| news & internet addict | nationalist | egoistic | argumentative |always curious | @narendramodi & @bjp4india supporter |	141	1	1
7/27/2015 11:39:51	625631680733147136	Beebagr_Baluch	Pakistani Army, ISI AND Islamic Jihadist involved in #gurdaspurattack Now India Openly Support Baloch fr destroying Pak terrorism, @PMOIndia	dp of my leader hyrbyair marri #balochistan liberation #humanrights activist,freedom from #pakistan & #iran ,support #india & #israel #kurds #yezidi hate #isis	6009	1	1
7/27/2015 11:40:15	625631785351688192	pmodgill	#GurdaspurAttack Well done Indian Army &amp; Police. Killed these #Paki #Maggots. I wish death to all motherfucking #terrorists &amp; #islamists	businessman, entrepreneur, venture capitalist & philanthropist	71	1	1
7/27/2015 11:40:25	625631825562570752	SwarupPhD	Shut Up! Terror has no religion. MT @htTweets #Gurdaspur attackers heard shouting Islamic slogans http://t.co/9IByYAiP3E #GurdaspurAttack	scientist. president of hindu secular forum. 1% of rts may be endorsement. fighting to save world from islamic jihad.	14840	1	1
7/27/2015 11:40:51	625631934513721344	kannandelhi	We should forget India vs Pakistan sporting ties at home or away. Tricky Pakis will never learn. #GurdaspurAttack @mail_today		154	1	1
7/27/2015 11:42:19	625632305487351808	shambhunathjha4	#GurdaspurAttack Pakis send der men to die and attain salvation in India		0	1	1
7/27/2015 11:42:51	625632438765535232	zamuran98	Pakistani Army, ISI AND Islamic Jihadist involved in #gurdaspurattack Now India Openly Support Baloch fr destroying Pak terrorism, @PMOIndia	baloch journalists forum  ex anchor of a bn tv	816	1	1
7/27/2015 11:43:30	625632603400351746	mswami	Indian Media conceals #GurdaspurAttack is by Muslim Jihadis while international media&amp;our Army have confirmed it! http://t.co/aFHfXQxvdz	maverick,non-sikular liberal , house husband and a gainfully unemployed bloke watching the world in amusement! alumni of xlri. detest left-lib elite	1478	1	1
7/27/2015 11:43:34	625632617560281088	Sriram_sv	#GurdaspurAttack is a slap on terror sympathisers in opposition nd Indian #presstitutes #AdarshLiberals ,if they consider it as agnst india	comments are personal . rt's may or may not imply as endorsements	457	1	1
7/27/2015 11:44:29	625632847462858752	USusheel	#AdarshLiberals you have another #IshratJahan today, start breaking your bangles &amp; whining! #GurdaspurAttack https://t.co/fD43GHMdm2	hindu nationalist. tweets are my personal views.. rt ≠ endorsement	252	1	0
7/27/2015 11:46:10	625633270844260352	indomitablesoul	Feeling so proud of Punjab Police who defended n defeated all Paki Rats when challenged in #GurdaspurAttack Now neutralize whoever involved	mechanical engg. patriot,foodie,footballer,sportsfan,traveller n rebel @ heart.nation comes first,always n everytime. live n let live.jai hind!tweets r personal	83	1	2
7/27/2015 11:46:19	625633309083631616	parasarabhijit	@batangadbaaz @bhaiyyajispeaks Its time to open wagha border for pakis to take their relative's bodies back #GurdaspurAttack	i think before i tweet, i don't copy, and my tweets are my personal opinion.	43	1	1
7/27/2015 11:46:35	625633378486738944	RamraoKP_	Pakistani islamic terrorists behind #GurdaspurAttack . Prove me wrong.. #Hangyakub https://t.co/tEcWg5JRMq	|  | hindu nationalist | | brahmin | |nationfirst | |ram ji bhakt | |member of @bjpindia | #hindusarehumantoo | |bharat mata ki jai| |vandemataram|	2515	1	1
7/27/2015 11:47:10	625633525769699328	g7ayush	When Jihadis scream "Allahu Akbar" attack and kill people, thats proof its nothing to do with Islam. #GurdaspurAttack	dharmic | nationalist | kafir | military enthusiast | tweets about politics, culture & religion	194	1	0
7/27/2015 11:47:53	625633705722290176	LegalKant	#GurdaspurAttack terrorists shouted Islamic slogans. Terrorism and terrorists both has a religion. Islamic Terror.	avocat / conomiste / paris-sorbonne	231	1	1
7/27/2015 11:51:17	625634560257212416	AmerPadma	@SD203 @BDUTT &lt;-- she won't because anti-national anti-Hindu @INCIndia is led by secular italian &amp; her semi italian brood #GurdaspurAttack	vande mataram! retweets are not endorsements.	658	1	0
7/27/2015 11:51:43	625634670705643520	VirkSJ	What happened to that number of terrorists being 15; only 4 killed and there also was a lady jihadi what about that!?  #GurdaspurAttack	there are two kinds of people, one, born with a silver spoon & the other who defines the value of silver!! be the latter..	671	1	0
7/27/2015 11:54:30	625635369824817152	WandererSS6	I feel sorry for #AdarshLiberals &amp; Muslims like Owaisi. They must be really hurt after knowing all terrorist in #GurdaspurAttack killed.	mkt research analyst|kashmiri pandit deserted from our paradise|proud indian|believes in do what makes you happy.	403	1	1
7/27/2015 11:56:56	625635981190795264	harshvb	Terrorists shout Islamic slogans and they don't get offended but don't give color of religion to terrorism. #AdarshLiberals #GurdaspurAttack	404 - info could not found.	144	1	1
7/27/2015 11:58:12	625636298749947906	pat_monu	Now owaisi will say "Those terrorists were killed because they were muslims". #AdarshLiberals #GurdaspurAttack		94	1	1
7/27/2015 11:58:45	625636437740773378	aniksahaonline	@shivaroor after #GurdaspurAttack ,some separatist groups are trying to rise the Khalistan issue.DON'T LISTEN TO THEM.# #IndiaIs1	a proud indian.a writer.preacher of #mattersofinstinct and #besafe and trending tweets.admin of http://t.co/svkdqaljzp . a wattpader at http://t.co/judi2cjxy0	402	1	0
7/27/2015 11:59:09	625636538534092800	1heRebel	Owaisi must be crying at home as sharia terrorist were not able to free him in free country after shouting Islamic Slogans. #GurdaspurAttack		61	1	1
7/27/2015 11:59:25	625636608784625664	goodnewsofday	All three islamic extremist terrorist are killed in on going battle in Gurdaspur. #GurdaspurAttack		6	1	1
7/27/2015 11:59:27	625636616191643648	ChowmeinMonster	where are all the right wing nutjobs who were blaming Khalistan or aap where clearly they are islamic terrorists? #GurdaspurAttack	hot headed atheist	42	1	1
7/27/2015 11:59:31	625636630343188480	Creator1003	In return of bajrangi bhaijaan pakis give us return gift in the form of Punjab attacks today!!!! #GurdaspurAttack https://t.co/OYj0S177PH	hari om tatsat....	91	1	1
7/27/2015 11:59:38	625636659854356480	Sriram_sv	So Does it require #GurdaspurAttack to the souls in #AdarshLiberals nd Indian #presstitutes , to rethink on supportin terrorist #YakubMemon	comments are personal . rt's may or may not imply as endorsements	457	1	0
7/27/2015 11:59:41	625636674014285824	RamraoKP_	Hey @RanaAyyub terrorism has religion example  #GurdaspurAttack attackers are Islamic terrorists... https://t.co/x1x0txzBOt	|  | hindu nationalist | | brahmin | |nationfirst | |ram ji bhakt | |member of @bjpindia | #hindusarehumantoo | |bharat mata ki jai| |vandemataram|	2515	1	1
7/27/2015 11:59:55	625636732868890624	KartikeyaTanna	Our #AdarshLiberals journalists to do investigative journalism on the fake encounter of #GurdaspurAttack terrorists https://t.co/3pCenLcRwS	lawyer licensed in india, england & new york. visiting faculty, h.l. institute of commerce. write columns on politico-legal developments. photographer by hobby.	18733	1	0
7/27/2015 12:00:36	625636904030072832	sufirushk	Paki journalists India shud not suspect LeT, JuD. They r right needle of suspicion is pointing towards East India Company. #GurdaspurAttack	spiritual not religious, humor, history, science.proud kafir. follow back.	1966	1	0
7/27/2015 12:00:58	625636995025403905	vaz_paz	#GurdaspurAttack terrorist was shouting islamic slogans seculars in deep shock all ICU's occupied by them		141	1	1
7/27/2015 12:01:36	625637154610286592	mrnasirgujjar	Sikhs stage protest against Indias brutalities world wide #GurdaspurAttack #ModiAttacksGurdaspur #LiberateKhalistan http://t.co/zvA11A2ZOF	secretary information pmlq lahore #kalabaghdam	2021	1	1
7/27/2015 12:02:22	625637347850256385	avinashbhat01	Tmrrw Headlines by #AdarshLiberals on #GurdaspurAttack -It ws 'Chota Mota' Drug operation-Innocent Smuggleser killed in Fake Encounter	avid reader, news junkie, centre right and a highly opinionated contrarian.	7721	1	1
7/27/2015 12:04:43	625637939431763968	daanishmehra	#GurdaspurAttack Pakis show true colors yet again	dark knight , iron man , broken but not dead yet	84	1	1
7/27/2015 12:05:05	625638032645840896	FarisAliKhan2	Modi has been humiliated &amp; insulted on international level through #ModiAttacksGurdaspur killing 6 Hindus. Damn on Modi #GurdaspurAttack	a patriot. love pak sarzameen. striving to defeat enemy's propaganda against pakistan in cyber war. liberation of palestine, khalistan & freedom of kashmiris.	3121	1	1
7/27/2015 12:05:10	625638052690444288	mnivatkar	#gurdaspurattack send those so called 291 secularists for humanitarian talks with Terrorists to Gurudaspur immdly who wrote for Yakub	after all ... it's life	10	1	1
7/27/2015 12:05:30	625638137075609600	IndiaFPS	#GurdaspurAttack Gurdaspur attackers heard shouting Islamic slogans before final assault http://t.co/HyVmqIgGXu		5	1	1
7/27/2015 12:05:59	625638257905111040	FarisAliKhan2	#GurdaspurAttack is the first kind of attack in which Hindus are killing Hindus. What a shame. #Gurdaspur #modiattacksgurdaspur	a patriot. love pak sarzameen. striving to defeat enemy's propaganda against pakistan in cyber war. liberation of palestine, khalistan & freedom of kashmiris.	3121	1	1
7/27/2015 12:08:07	625638797091299329	Ankiity	@Ankiity All the terrorist from religion of PIECE. #GurdaspurAttack	थप्पड से डर नहीं लगता साहब, प्यार से लगता है। i refuse to trust anyone who smiles before 9am	3573	1	1
7/27/2015 12:08:53	625638987835641857	InfallibleKarma	Pakis firmly believe that Hindus/India wont resort to Military action.They seem 2 b right. Modi cant take tough decisions. #GurdaspurAttack	independent and objective	23	1	0
7/27/2015 12:09:15	625639080588500992	TimeToScoot	The recipe to kill the practice of martyrdom in Islam would be to replace '72 virgins' in the Qu'ran with '72 feminists'. #GurdaspurAttack	creator and owner of two websites - http://t.co/1zqhlhzko3 and http://t.co/exe7ll2sz8	186	1	1
7/27/2015 12:09:58	625639261635633152	nittin_	Gud news 4 #AdarshLiberals 1 terrorist hve been taken alive in #gurdaspurattack! Now u can play politics over his conviction in d comn days	adventurous, courageous, versatile, lively, positive, passionate, arrogant, stubborn, impulsive and confrontational.hindu nationalist	644	1	0
7/27/2015 12:12:19	625639854785716224	MLMANDOWARA	@SirZaidHamid: By killing terrorists in #GurdaspurAttack are we not becoming like terrorists themselves? Thoughts of #AdarshLiberals	i am retired vice principal of college education	783	1	1
7/27/2015 12:12:24	625639874612215808	InfallibleKarma	Modi bowed n shed tears d first day in Parliament.He cant b war minded.Pakis know that.But Indian voters fooled themselves #GurdaspurAttack	independent and objective	23	1	0
7/27/2015 12:12:53	625639997912272896	__UFH	#GurdaspurAttack is jihad on heart of Punjab ,brave sikhs will never forgive these muslim pigs for their coward act #Gurdaspur @RanaAyyub	mosquitoes refuse to bite me purely out of respect.follow me to improve your social status rts are your own endorsements	186	1	1
7/27/2015 12:13:34	625640167315894272	avinashbhat01	Today ISI will give brief bout how India responsible for #GurdaspurAttack Tmmrw #AdarshLiberals journos will write Op-eds Blaming Modi Govt	avid reader, news junkie, centre right and a highly opinionated contrarian.	7721	1	1
7/27/2015 12:14:52	625640494450630656	krharibhaskar	#AdarshLiberals tries2link every incident withBJP.Won't b surprised if they accuse BJP4Globalwarming.#GurdaspurAttack http://t.co/XhpjH1OSAP	die hard fan of #namo, गर्व हिंदू राष्ट्रवादी	280	1	0
7/27/2015 12:15:20	625640613539549184	AbdullahBugti9	Paki Army,ISI&amp;Islamic Jihadist involved in #gurdaspurattack #India should Support Baloch fr destroying Pak terrorism, http://t.co/RIpqZz7LBE	i am an activist of baloch republican party and struggling for freedom of balochistan,which is occupied by pakistan and iran.tweets are personal views.	468	1	1
7/27/2015 12:15:23	625640624969093120	Bharat_Putra	Terror has no Religion #GurdaspurAttack "Gurdaspur attackers heard shouting Islamic slogans before final assault http://t.co/v7xjhU5XYF "	my name is ram and i am not communal # #modigovtcritic #modi42019	6099	1	1
7/27/2015 12:15:31	625640657110069248	AapChorHain	Dear #AdarshLiberal it's time to sign another Mercy petition  #GurdaspurAttack https://t.co/rpWEoXWXDj		6712	1	0
7/27/2015 12:15:48	625640729092726785	Chirpreet	Why can't we build a permanent border wall to shun off these Pakis completely &amp; end this yrs of bull-shitting..!! #GurdaspurAttack	it professional, sports buff and a foodie..!! in no particular order..!	54	1	1
7/27/2015 12:15:53	625640750080856064	brijeshdeb	Wondering if @PMOIndia paid attention to #liberatekhalistan trend in our neighborhood for the past few days. @narendramodi #gurdaspurattack	engineer, philosopher, an avid talker, writer and always a tester! views expressed here are personal.	239	1	1
7/27/2015 12:17:22	625641125697601536	shrik143	#libtards are ready with mercy petition for reported terrorist caught alive . Only name has been left blank to fill later . #GurdaspurAttack	doctor for health ,illnesses attacking india.	205	1	1
7/27/2015 12:17:25	625641135101218816	Hwy99Boss	Coward Pakis hit again #GurdaspurAttack	☜☆☞ i don't give bullshits nor do i take bullshits! ☜☆☞	227	1	1
7/27/2015 12:17:34	625641173630087168	sumit_saxena26	#GurdaspurAttack shame on you sickular peoples		3	1	1
7/27/2015 12:17:47	625641230001508352	manavjivan	Home Minister Rajnath Singh #GurdaspurAttack Same shik during Cong, same shik with BJP with 56 inch chest boss. Indians are at Paki mercy!!	twitter translator (spanish), dreams manufacturer. manav = limited edition. my rts may be questionable, but follow me unquestionably :)	43823	1	1
7/27/2015 12:18:07	625641311660605440	coolronald	#GurdaspurAttack Illiterate madrasa-trained Pakis talk with Con"Man"Gress to spread their canard abt Modi involvement!	president, cto, cco, aglaia interactive. a university-level quiz winner, topper- love reading, travelling and networking. author in the british council, sussex.	254	1	1
7/27/2015 12:18:34	625641425217044480	sunil_kachroo	Nothing to do with Khalistan or anybody like that , this was a Islamic Jehad attack by Laksher #GurdaspurAttack	i wear my religion on my sleeve and proud of it......haar nahin manoonga raar nayee thanoonga ,kal ke kapal par likhta, mitata hoon.....@silk72.wordpress.com	1428	1	2
7/27/2015 12:18:44	625641466577092608	vijaygiraddi	One terrorist is caught alive, now expect op ed from sickular mafia.after few yrs agn court drama, mercy pitition.#GurdaspurAttack		43	1	1
7/27/2015 12:19:11	625641581643563008	rvirendra	Terrorists raised Islamic Slogans, but terrorism has no religion #GurdaspurAttack #Gurdaspur	proud indian,from dehradun uttrakhand	100	1	2
7/27/2015 12:19:12	625641583610720256	dilip_sagitra	Punjab police personal said they heard islamic slogan Allah hu Akbar.. still u believe that terrorist hv no religion ??? #GurdaspurAttack	| proud hindu nationalist | bharatiya | satyamev jayate | vande mataram | mechanical engineering student |	78	1	1
7/27/2015 12:20:32	625641921478721536	zamuran98	Pakistni Army, ISI &amp; Islamic Jihadist involved in #gurdaspurattack Now India Openly Support Baloch fr destroying Pak terorism @narendramodi	baloch journalists forum  ex anchor of a bn tv	816	1	1
7/27/2015 12:20:55	625642017238970368	secular786	#DalalCoupta @ShekharGupta is a peace loving Hindu Sikh today &amp; knows that #Khalistan boys misunderstood #GurugranthSahib #GurdaspurAttack	aurangzeb is the secular father of india.	689	1	0
7/27/2015 12:21:44	625642221069406208	krharibhaskar	Pappu's reaction on #Gurdaspur terror attack #AAPwithTerrorists #GurdaspurAttack http://t.co/Gkj0XRWp1q	die hard fan of #namo, गर्व हिंदू राष्ट्रवादी	280	1	0
7/27/2015 12:24:29	625642913532284928	zamuran98	Pakistni Army,ISI AND Islamic Jihadist involved in #gurdaspurattack Now India Openly Suport Baloch fr destroying Pak terorism @PriyaMadhav1	baloch journalists forum  ex anchor of a bn tv	816	1	1
7/27/2015 12:27:14	625643609191157760	mayanknxt	@narendramodi Indians - #AdarshLiberals- #Sickulars - #presstitutes are wid U. Attack perpetrators of #GurdaspurAttack.NO TALKS WID PAK		0	1	0
7/27/2015 12:27:37	625643702044659712	ReddyMurali9993	For twist in facts watch MSM screaming Islam is peaceful &amp; terrorists hav no religion #GurdaspurAttack	hindu nationalist.	41	1	1
7/27/2015 12:28:48	625644002977583104	Tweejoteet	Khalistan Movement Zindabad! We totally support our Sikh Brothers for their freedom Movement. #GurdaspurAttack #IndiaIsTerrorist!	mining and metallurgical engineer, attracted to consciousness, high vibrations, soul intelligence, and open minded conversations.	1265	1	0
7/27/2015 12:29:00	625644051182809088	ruchaparmar	So pathetic ! All the parties r playing politics over #GurdasPurAttack and #SalmanKhan , #Yakub controversy ! #Shame	i really love #georgebailey,@abdevilliers17,@gmaxi_32 & @kp24. #kxip @blackcaps #proteafire.crazy for leo messi & @cristiano..!	161	1	0
7/27/2015 12:32:33	625644945001414656	mahe1966	nation is congratultng the police 4 putng end 2 terror atck,secular journalist r in process of writing contrdc stories #GurdaspurAttack	experiantial & rural marketeer- the urge to learn keeps me going. stopped watching cricket but will tweet on it. i retweet only interesting things	183	1	2
7/27/2015 12:33:35	625645204293357568	mriganka_t	Waiting for #AdarshLiberals to declare #GurdaspurAttack a RAW conspiracy to counter 'growing' support for clemency to #YakubMemon.	an indian. and a technology enthusiast for now. bragging rights - blocked by some #adarshliberals.	96	1	1
7/27/2015 12:34:14	625645368269627392	rvirendra	One terrorist arrested, India's ch**** Secularist ll be ready with one more petition to give him VIP treatment in the jail #GurdaspurAttack	proud indian,from dehradun uttrakhand	100	1	1
7/27/2015 12:34:30	625645434912923648	thakervm	#AdarshLiberals: "Hey Ram" were the last words of #GurdaspurAttack terrorist!! https://t.co/nJ3iRIDH0a	proud hindu with nationalist views. glass is always full. never afraid of speaking my mind. namo namah. interests in politics, sports, bollywood and literature.	1471	1	1
7/27/2015 12:35:28	625645677339611136	goodnewsofday	Check out the Jawans who neutralized Islamic terrorist in Gurdaspur. The army gear seems updated. #GurdaspurAttack http://t.co/mxfnGimNSH		6	1	1
7/27/2015 12:35:51	625645775989686272	RiRiIsDeBest	Islamic terrorism has hit the whole world. It's time for Muslims to start acting. Don't let a minority ruin your image. #GurdaspurAttack		2134	1	1
7/27/2015 12:36:04	625645829471105025	pratik_mohite	That's what Indian politicians can do with Pakistan after terrorist attacks?? #Shame #GurdaspurAttack https://t.co/wbn4jpZP88	digital media team | blogger | social media activist | political commentator | gandhian | #mba student | share market trader | followed by @incindia #rotractor	1412	1	1
7/27/2015 12:36:35	625645959951745025	m4muni	All Media flooded with #GurdaspurAttack Now its high time to arrest another AAP MLA, Expecting an arrest soon #Presstitutes Twist	i am a mango man | doing mca | 17 yrs of uae life | adjusting incredible india | be the change to change india | bharath jaldi badlega | shuruvat ki hei aap ne	253	1	1
7/27/2015 12:37:19	625646145151184897	sribang	@ggiittiikkaa @bhat_sadhana Expect massive rally by seculars n #presstitutes against killng 3 of thr bros visitng india #GurdaspurAttack	prefectly imperfect.	129	1	1
7/27/2015 12:37:41	625646235005747200	OahuAkbar	lets not conclusions just because they yelled islamic slogans injump to  the #GurdaspurAttack doesnt mean it had anything to do with islam	submit to allah	430	1	2
7/27/2015 12:37:52	625646284808912896	agrideva	India has to learn that you can't trust terrorists and pakis,for they go hand in hand. #GurdaspurAttack		48	1	1
7/27/2015 12:38:01	625646319802019840	indianhindu16	these terror strike happens because jesus ass lickers like @Zakka_Jacob suck up to those jihadis @ibnlive #GurdaspurAttack #AbrahamicBros	just because i love hinduism doesnt mean i disrespect other religion but if someone mocks at my faith..i am sure i will give them a piece of my mouth	368	1	1
7/27/2015 12:38:57	625646555727400960	SREEHARI2001	The SUFFERINGS of Sikhs is more at all times..in the hands of ENDANGERED Notional Parties in India..than Pakis..#GurdaspurAttack #TamilNadu	inquisitive, intelligent to pick the right arrow for the right cause, moderate, usually less provoked.	786	1	1
7/27/2015 12:41:32	625647206008160256	SREEHARI2001	SUFFERINGS of Sikhs &amp; Tamils are more in the hands of ENDANGERED CENTRAL COLLUSION in India than Pakis at all times.#GurdaspurAttack #AIADMK	inquisitive, intelligent to pick the right arrow for the right cause, moderate, usually less provoked.	786	1	1
7/27/2015 12:41:39	625647233740861440	LfcBisht	Terrorist raised Islamic slogans and as usual defamed their own religion #GurdaspurAttack	indian. liverpool fc and barca fan. support modi but not rss	617	1	1
7/27/2015 12:41:58	625647314863063040	_AOK_FC_	Hw fool muslims r: they cum, fire 4 sumtime den die. #Stupids HaHa. #Meaningless #GurdaspurAttack	fan club of most beautiful anchor ie anjana om kashyap. queen of debate and lovely person. this acc only dedicated to her :) u can follow her @anjanaomkashyap	343	1	1
7/27/2015 12:42:55	625647554638708736	vaib233	#GurdaspurAttack now punjabis shd kill atleast 50 muslims to avenge attacks on sikhs.....all hindus gear up	i am prof in an engineering college.having a strong belief in hinduism...there on twitter to unite all indians..	158	1	1
7/27/2015 12:42:56	625647559927689216	SREEHARI2001	SUFFERINGS of Sikhs&amp;Tamils are more in hands of ENDANGERED CENTRAL COLLUSION in India than Pakis at all times.#GurdaspurAttack @News7tamil	inquisitive, intelligent to pick the right arrow for the right cause, moderate, usually less provoked.	786	1	1
7/27/2015 12:43:41	625647745689260032	BalakNadan	Terrorist attack in Pak: We shout #IndiaWithPakistan Terrorist attach in India: Fucking Prokis shouting #LiberateKhalistan #GurdaspurAttack	hated by many, liked by very very few.	334	1	1
7/27/2015 12:43:45	625647761870864384	Rakupadhyay	Why is Punjab Police saying terrorists were shouting Islamic slogans? will spread hatred in society against one community. #GurdaspurAttack	i can't think of anything to write. i am new to twitter. on here to connect with people i know & don't know. follow me if you want to know more. cheers!	117	1	2
7/27/2015 12:47:45	625648769862774784	whisky_wacko	Now that all terrorists have been eliminated, libtards can start pontificating how Islam is really a religion of peace. #GurdaspurAttack	indian | right-wing | atheist | rts not necessarily endorsements | formerly desi hypocrisy watch/whisky wacko	1838	1	1
7/27/2015 12:48:02	625648839735685120	shrik143	Centre bans live coverage and some news channels started boasting how much patriots they are. #presstitutes #GurdaspurAttack @ndtv @ShainaNC	doctor for health ,illnesses attacking india.	205	1	1
